{
  "$schema": "https://json-schema.org/draft/2020-12/schema",
  "title": "Wewo QA Test Point Baseline",
  "type": "object",
  "additionalProperties": false,
  "required": [
    "schema_version",
    "generated_at",
    "project",
    "sources",
    "decisions",
    "requirement_units",
    "tree",
    "design_context_baseline",
    "design_review"
  ],
  "properties": {
    "schema_version": {
      "const": "1.4"
    },
    "generated_at": {
      "type": "string",
      "format": "date-time"
    },
    "project": {
      "type": "object",
      "additionalProperties": false,
      "required": [
        "name",
        "artifact_id",
        "requirement",
        "baseline",
        "targets"
      ],
      "properties": {
        "name": {
          "type": "string",
          "minLength": 1
        },
        "artifact_id": {
          "type": "string",
          "pattern": "^[a-z0-9]+(?:[a-z0-9-]*[a-z0-9])?$"
        },
        "requirement": {
          "type": "string",
          "minLength": 1
        },
        "baseline": {
          "type": "string",
          "minLength": 1
        },
        "targets": {
          "type": "array",
          "minItems": 1,
          "items": {
            "$ref": "#/$defs/target"
          }
        },
        "output_language": {
          "enum": [
            "zh-CN",
            "en"
          ],
          "description": "Delivery language selected from the user preference and clarification conversation; omitted legacy values mean zh-CN."
        }
      }
    },
    "sources": {
      "type": "array",
      "minItems": 1,
      "items": {
        "$ref": "#/$defs/source"
      }
    },
    "decisions": {
      "type": "array",
      "items": {
        "$ref": "#/$defs/decision"
      }
    },
    "requirement_units": {
      "type": "array",
      "minItems": 1,
      "items": {
        "$ref": "#/$defs/requirement_unit"
      }
    },
    "tree": {
      "$ref": "#/$defs/test_point"
    },
    "design_context_baseline": {
      "type": "object",
      "additionalProperties": false,
      "properties": {
        "path": {
          "const": "design-context.json"
        },
        "sha256": {
          "type": "string",
          "pattern": "^[a-f0-9]{64}$"
        }
      },
      "required": [
        "path",
        "sha256"
      ]
    },
    "design_review": {
      "type": "object",
      "additionalProperties": false,
      "properties": {
        "snapshot_sha256": {
          "type": "string",
          "pattern": "^[a-f0-9]{64}$"
        },
        "checked_leaf_refs": {
          "type": "array",
          "items": {
            "type": "string",
            "minLength": 1
          },
          "minItems": 1,
          "uniqueItems": true
        },
        "atomicity_note": {
          "type": "string",
          "minLength": 1
        },
        "visible_path_note": {
          "type": "string",
          "minLength": 1
        }
      },
      "required": []
    }
  },
  "$defs": {
    "nonempty_string_array": {
      "type": "array",
      "items": {
        "type": "string",
        "minLength": 1
      }
    },
    "target": {
      "type": "object",
      "additionalProperties": false,
      "required": [
        "id",
        "name",
        "surface",
        "os",
        "in_scope"
      ],
      "properties": {
        "id": {
          "type": "string",
          "pattern": "^[a-z0-9]+(?:[a-z0-9-]*[a-z0-9])?$"
        },
        "name": {
          "type": "string",
          "minLength": 1
        },
        "surface": {
          "enum": [
            "web",
            "mobile-app",
            "desktop-app",
            "mini-program",
            "other",
            "api"
          ]
        },
        "os": {
          "enum": [
            "platform-independent",
            "windows",
            "macos",
            "linux",
            "android",
            "ios",
            "other"
          ]
        },
        "browser": {
          "type": "string",
          "minLength": 1
        },
        "browser_version": {
          "type": "string",
          "minLength": 1
        },
        "os_version": {
          "type": "string",
          "minLength": 1
        },
        "device": {
          "type": "string",
          "minLength": 1
        },
        "device_mode": {
          "enum": [
            "real-device",
            "simulator",
            "emulator",
            "not-applicable"
          ]
        },
        "host": {
          "type": "string",
          "minLength": 1
        },
        "in_scope": {
          "type": "boolean"
        },
        "notes": {
          "type": "string"
        }
      }
    },
    "source": {
      "type": "object",
      "additionalProperties": false,
      "required": [
        "id",
        "title",
        "type",
        "locator",
        "authority"
      ],
      "properties": {
        "id": {
          "type": "string",
          "pattern": "^SRC-[0-9]{3,}$"
        },
        "title": {
          "type": "string",
          "minLength": 1
        },
        "type": {
          "enum": [
            "dingtalk-doc",
            "document",
            "spreadsheet",
            "presentation",
            "pdf",
            "image",
            "audio",
            "video",
            "xmind",
            "url",
            "text",
            "other"
          ]
        },
        "locator": {
          "type": "string",
          "minLength": 1
        },
        "version": {
          "type": "string"
        },
        "retrieved_at": {
          "type": "string",
          "format": "date-time"
        },
        "authority": {
          "enum": [
            "authoritative",
            "supporting",
            "historical",
            "unknown"
          ]
        },
        "notes": {
          "type": "string"
        },
        "sha256": {
          "type": "string",
          "pattern": "^[a-f0-9]{64}$"
        }
      }
    },
    "decision": {
      "type": "object",
      "additionalProperties": false,
      "required": [
        "id",
        "unit_id",
        "question_id",
        "topic",
        "resolution",
        "status"
      ],
      "properties": {
        "id": {
          "type": "string",
          "pattern": "^DEC-[0-9]{3,}$"
        },
        "unit_id": {
          "type": "string",
          "pattern": "^RU-[0-9]{3,}$"
        },
        "question_id": {
          "type": "string",
          "pattern": "^(Q[1-9][0-9]*\\.[1-9][0-9]*|Q-RU[0-9]{3,}-[0-9]{2,})$"
        },
        "selected_options": {
          "type": "array",
          "uniqueItems": true,
          "items": {
            "type": "string",
            "pattern": "^[A-D]$"
          }
        },
        "topic": {
          "type": "string",
          "minLength": 1
        },
        "resolution": {
          "type": "string",
          "minLength": 1
        },
        "status": {
          "enum": [
            "confirmed",
            "assumed"
          ]
        },
        "rationale": {
          "type": "string"
        }
      }
    },
    "requirement_unit": {
      "type": "object",
      "additionalProperties": false,
      "required": [
        "id",
        "title",
        "source_refs",
        "status",
        "understanding",
        "confirmed_facts"
      ],
      "properties": {
        "id": {
          "type": "string",
          "pattern": "^RU-[0-9]{3,}$"
        },
        "title": {
          "type": "string",
          "minLength": 1
        },
        "source_refs": {
          "type": "array",
          "minItems": 1,
          "items": {
            "type": "string",
            "minLength": 1
          }
        },
        "status": {
          "enum": [
            "confirmed",
            "assumed",
            "excluded"
          ]
        },
        "understanding": {
          "type": "string",
          "minLength": 1
        },
        "confirmed_facts": {
          "type": "array",
          "minItems": 0,
          "uniqueItems": true,
          "items": {
            "type": "string",
            "minLength": 1
          }
        },
        "assumptions": {
          "$ref": "#/$defs/nonempty_string_array"
        },
        "exclusion_reason": {
          "type": "string",
          "minLength": 1
        }
      },
      "allOf": [
        {
          "if": {
            "properties": {
              "status": {
                "const": "assumed"
              }
            },
            "required": [
              "status"
            ]
          },
          "then": {
            "required": [
              "assumptions"
            ]
          }
        },
        {
          "if": {
            "properties": {
              "status": {
                "const": "excluded"
              }
            },
            "required": [
              "status"
            ]
          },
          "then": {
            "required": [
              "exclusion_reason"
            ]
          }
        }
      ]
    },
    "test_point": {
      "type": "object",
      "additionalProperties": false,
      "required": [
        "id",
        "title",
        "kind",
        "status",
        "requirement_unit_refs",
        "trace_refs",
        "children",
        "coverage_item_refs"
      ],
      "properties": {
        "id": {
          "type": "string",
          "pattern": "^TP-(?:ROOT|[A-Z0-9]+(?:-[A-Z0-9]+)*)$"
        },
        "title": {
          "type": "string",
          "minLength": 1
        },
        "kind": {
          "enum": [
            "root",
            "module",
            "feature",
            "flow",
            "rule",
            "state",
            "input",
            "boundary",
            "negative",
            "platform",
            "oracle",
            "other"
          ]
        },
        "status": {
          "enum": [
            "confirmed",
            "assumed"
          ]
        },
        "requirement_unit_refs": {
          "type": "array",
          "uniqueItems": true,
          "items": {
            "type": "string",
            "pattern": "^RU-[0-9]{3,}$"
          }
        },
        "trace_refs": {
          "type": "array",
          "uniqueItems": true,
          "items": {
            "type": "string",
            "minLength": 1
          }
        },
        "rationale": {
          "type": "string",
          "minLength": 1
        },
        "automation_candidate": {
          "type": "boolean"
        },
        "notes": {
          "type": "string"
        },
        "children": {
          "type": "array",
          "items": {
            "$ref": "#/$defs/test_point"
          }
        },
        "rule_refs": {
          "type": "array",
          "items": {
            "type": "string",
            "minLength": 1
          },
          "minItems": 1,
          "uniqueItems": true
        },
        "verification": {
          "type": "object",
          "additionalProperties": false,
          "properties": {
            "condition": {
              "type": "string",
              "minLength": 1
            },
            "action": {
              "type": "string",
              "minLength": 1
            },
            "expected": {
              "type": "string",
              "minLength": 1
            }
          },
          "required": [
            "condition",
            "action",
            "expected"
          ]
        },
        "coverage_item_refs": {
          "type": "array",
          "items": {
            "type": "string",
            "pattern": "^COV-[A-Z0-9]+(?:-[A-Z0-9]+)*$"
          },
          "minItems": 0,
          "uniqueItems": true
        },
        "outcome_ref": {
          "type": "string",
          "pattern": "^OUT-[A-Z0-9]+(?:-[A-Z0-9]+)*$"
        }
      },
      "allOf": [
        {
          "if": {
            "properties": {
              "status": {
                "const": "assumed"
              }
            },
            "required": [
              "status"
            ]
          },
          "then": {
            "required": [
              "rationale"
            ]
          }
        },
        {
          "if": {
            "properties": {
              "children": {
                "maxItems": 0
              },
              "kind": {
                "not": {
                  "const": "root"
                }
              }
            },
            "required": [
              "children",
              "kind"
            ]
          },
          "then": {
            "required": [
              "rule_refs",
              "verification",
              "outcome_ref"
            ]
          }
        }
      ]
    }
  }
}
